{"success":true,"data":{"id":21,"name":"NewPage","category_id":12,"category_name":"Browser","description":"Creates a new browser page or tab for web automation.","short_description":"Create a new browser page","function":"codebolt.browser.newPage()","examples":"// It's good practice to wait for the connection to be established first.\nawait codebolt.waitForConnection();\n\n// Create a new browser page\nconst newPageResult = await codebolt.browser.newPage();\nconsole.log('New page creation result:', newPageResult);\n\nif (newPageResult.success) {\n  console.log('Successfully created a new page.');\n  // Now you can navigate to a URL\n  await codebolt.browser.goToPage('https://example.com');\n  const currentUrl = await codebolt.browser.getUrl();\n  console.log('Current URL:', currentUrl.url);\n} else {\n  console.error('Failed to create a new page:', newPageResult.error);\n}","tags":"newPage","created_at":"2025-07-09 11:44:12","updated_at":"2025-07-09 11:44:12","input_zod_schema":{},"output_zod_schema":{},"input_example":"const newPageResult = await codebolt.browser.newPage();","output_example":"{\n  \"type\": \"newPageResponse\",\n  \"success\": true,\n  \"message\": \"New page created successfully\"\n}","input_json_schema":"{\n  \"type\": \"object\",\n  \"properties\": {},\n  \"required\": [],\n  \"additionalProperties\": false\n}","output_json_schema":"{\n  \"type\": \"object\",\n  \"properties\": {\n    \"type\": {\n      \"type\": \"string\",\n      \"const\": \"newPageResponse\",\n      \"description\": \"Always 'newPageResponse'.\"\n    },\n    \"success\": {\n      \"type\": \"boolean\",\n      \"description\": \"Indicates if the operation was successful.\"\n    },\n    \"message\": {\n      \"type\": \"string\",\n      \"description\": \"A message with additional information.\"\n    },\n    \"error\": {\n      \"type\": \"string\",\n      \"description\": \"Error details if the operation failed.\"\n    }\n  },\n  \"required\": [\"type\"],\n  \"additionalProperties\": false\n}","input_variable_description":"This method takes no parameters and creates a new browser page or tab.","output_variable_description":{},"additional_notes":{},"mcp_server_name":"codebolt--browser-newPage","mcp_server_function":{},"common_use_cases":{},"raw_content":"---\nname: newPage\ncbbaseinfo:\n  description: Creates a new browser page or tab for web automation.\ncbparameters:\n  parameters: []\n  returns:\n    signatureTypeName: Promise<BrowserActionResponseData>\n    description: A promise that resolves with a `BrowserActionResponseData` object when the new page is created.\ndata:\n  name: newPage\n  category: browser\n  link: newPage.md\n---\n\n### Response Structure\n\nThe method returns a Promise that resolves to a `BrowserActionResponseData` object, which may contain the following properties:\n\n- **`type`** (string): Always \"newPageResponse\".\n- **`success`** (boolean, optional): Indicates if the operation was successful.\n- **`message`** (string, optional): A message with additional information.\n- **`error`** (string, optional): Error details if the operation failed.\n\n### Explanation\n\nThe `codebolt.browser.newPage()` function initializes a new browser tab or window, providing a fresh browsing context for automation tasks. It is the starting point for most web automation workflows. After creating a new page, you can use other `cbbrowser` functions to navigate, interact with, and extract content from web pages."}}