{"success":true,"data":{"id":33,"name":"SendConfirmationRequest","category_id":14,"category_name":"Chat","description":"Sends a confirmation request to the server with customizable buttons.","short_description":"Send confirmation dialog to user","function":"codebolt.chat.sendConfirmationRequest(confirmationMessage: string, buttons?: string[], withFeedback?: boolean)","examples":"// Example 1: Send a confirmation request with custom buttons\nconst response = await codebolt.chat.sendConfirmationRequest(\n    \"Would you like to continue with this operation?\",\n    [\"Yes, continue\", \"No, cancel\"],\n    true\n);\n\nconsole.log(\"User response:\", response);\n// Access the actual user selection\nconst userChoice = response.message.feedbackMessage;\nconsole.log(\"User selected:\", userChoice);\n\n// Example 2: Simple Yes/No confirmation (default buttons)\nconst confirmResponse = await codebolt.chat.sendConfirmationRequest(\n    \"Are you sure you want to delete this file?\",\n    [], // Uses default Yes/No buttons\n    false\n);\n\nif (confirmResponse.message.feedbackMessage === \"Yes\") {\n    console.log(\"User confirmed deletion\");\n} else {\n    console.log(\"User cancelled deletion\");\n}\n\n// Example 3: Multiple choice confirmation with feedback\nconst actionResponse = await codebolt.chat.sendConfirmationRequest(\n    \"How would you like to handle this conflict?\",\n    [\"Overwrite\", \"Skip\", \"Merge\", \"Cancel\"],\n    true\n);\n\nconst selectedAction = actionResponse.message.feedbackMessage;\nconsole.log(\"Selected action:\", selectedAction);","tags":"sendConfirmationRequest","created_at":"2025-07-09 12:34:33","updated_at":"2025-07-09 12:34:33","input_zod_schema":{},"output_zod_schema":{},"input_example":"const response = await codebolt.chat.sendConfirmationRequest(\"Continue with operation?\", [\"Yes\", \"No\"], false);","output_example":"\"Yes\"","input_json_schema":"{\n  \"type\": \"object\",\n  \"properties\": {\n    \"confirmationMessage\": {\n      \"type\": \"string\",\n      \"description\": \"The message to display in the confirmation.\",\n      \"minLength\": 1\n    },\n    \"buttons\": {\n      \"type\": \"array\",\n      \"description\": \"An array of button labels. Defaults to Yes/No if not specified.\",\n      \"items\": {\n        \"type\": \"string\"\n      },\n      \"default\": [\"Yes\", \"No\"]\n    },\n    \"withFeedback\": {\n      \"type\": \"boolean\",\n      \"description\": \"Whether to allow additional feedback input. Default is false.\",\n      \"default\": false\n    }\n  },\n  \"required\": [\"confirmationMessage\"],\n  \"additionalProperties\": false\n}","output_json_schema":"{\n  \"type\": \"string\",\n  \"description\": \"The user's response or button selection as a string.\"\n}","input_variable_description":"The `confirmationMessage` parameter is required and contains the confirmation text. The `buttons` parameter is optional and defaults to Yes/No. The `withFeedback` parameter is optional and enables additional text input.","output_variable_description":{},"additional_notes":{},"mcp_server_name":"codebolt--chat-sendConfirmationRequest","mcp_server_function":{},"common_use_cases":{},"raw_content":"---\nname: sendConfirmationRequest\ncbbaseinfo:\n  description: Sends a confirmation request to the server with customizable buttons.\ncbparameters:\n  parameters:\n    - name: confirmationMessage\n      typeName: string\n      description: The message to display in the confirmation.\n    - name: buttons\n      typeName: string[]\n      description: An array of button labels. Defaults to Yes/No if not specified.\n    - name: withFeedback\n      typeName: boolean\n      description: Whether to allow additional feedback input. Default is false.\n  returns:\n    signatureTypeName: Promise\n    description: A promise that resolves with the server's response.\n    typeArgs:\n      - type: string\n        name: string\ndata:\n  name: sendConfirmationRequest\n  category: chat\n  link: sendConfirmationRequest.md\n---\n\n### Response Structure\n\nThe method returns a Promise that resolves to a `string` containing the user's response or button selection.\n\nThis method waits for the user to respond to the confirmation request and returns their selection as a string. The response corresponds to:\n- The text of the button the user clicked (e.g., \"Yes\", \"No\", \"Continue\", etc.)\n- The feedback text if `withFeedback` is enabled and the user provides additional input\n- The exact button label if custom buttons are provided\n\n### Explanation\n\nThe `sendConfirmationRequest` function sends a confirmation request to the user with customizable buttons and optional feedback input. This is useful for getting user approval before performing operations or collecting simple input from the user. The function returns a comprehensive response object containing the user's selection and additional metadata for tracking and processing."}}